<?xml version="1.0" encoding="UTF-8"?>
<!-- Author: Reiner Sailer, Ray Valdez {sailer,rvaldez}@us.ibm.com  -->
<!--             This file defines the security policies, which     -->
<!--             can be enforced by the Xen Access Control Module.  -->
<!--             Currently: Chinese Wall and Simple Type Enforcement-->
<SecurityPolicyDefinition xmlns="http://www.ibm.com" xmlns:xsi="http://www.w3.org/2001/XMLSchema-instance" xsi:schemaLocation="http://www.ibm.com ../../security_policy.xsd ">
	<PolicyHeader>
		<PolicyName>example.chwall.client_v1</PolicyName>
		<PolicyUrl>www.ibm.com/example/chwall/client_v1</PolicyUrl>
		<Date>2006-03-31</Date>
	</PolicyHeader>
	<!--                                             -->
	<!-- example of a chinese wall type definition   -->
	<!-- along with its conflict sets                -->
	<!-- (typse in a confict set are exclusive, i.e. -->
	<!--  once a Domain with one type of a set is    -->
	<!--  running, no other Domain with another type -->
	<!--  of the same conflict set can start.)       -->
	<ChineseWall priority="PrimaryPolicyComponent">
		<ChineseWallTypes>
			<Type>cw_SystemManagement</Type>
			<Type>cw_Sensitive</Type>
			<Type>cw_Isolated</Type>
			<Type>cw_Distrusted</Type>
		</ChineseWallTypes>
		<ConflictSets>
			<Conflict name="Protection1">
				<Type>cw_Sensitive</Type>
				<Type>cw_Distrusted</Type>
			</Conflict>
		</ConflictSets>
	</ChineseWall>
	<SecurityLabelTemplate>
		<SubjectLabels bootstrap="dom_SystemManagement">
			<!-- single ste typed domains            -->
			<!-- ACM enforces that only domains with -->
			<!-- the same type can share information -->
			<!--                                     -->
			<!-- Bootstrap label is assigned to Dom0 -->
			<VirtualMachineLabel>
				<Name>dom_HomeBanking</Name>
				<ChineseWallTypes>
					<Type>cw_Sensitive</Type>
				</ChineseWallTypes>
			</VirtualMachineLabel>

			<VirtualMachineLabel>
				<Name>dom_Fun</Name>
				<ChineseWallTypes>
					<Type>cw_Distrusted</Type>
				</ChineseWallTypes>
			</VirtualMachineLabel>

			<VirtualMachineLabel>
				<!-- donating some cycles to seti@home -->
				<Name>dom_BoincClient</Name>
				<ChineseWallTypes>
					<Type>cw_Isolated</Type>
				</ChineseWallTypes>
			</VirtualMachineLabel>

			<!-- Domains with multiple ste types services; such domains   -->
			<!-- must keep the types inside their domain safely confined. -->
			<VirtualMachineLabel>
				<Name>dom_SystemManagement</Name>
				<ChineseWallTypes>
					<Type>cw_SystemManagement</Type>
				</ChineseWallTypes>
			</VirtualMachineLabel>

			<VirtualMachineLabel>
				<!-- serves persistent storage to other domains -->
				<Name>dom_StorageDomain</Name>
				<ChineseWallTypes>
					<Type>cw_SystemManagement</Type>
				</ChineseWallTypes>
			</VirtualMachineLabel>

			<VirtualMachineLabel>
				<!-- serves network access to other domains -->
				<Name>dom_NetworkDomain</Name>
				<ChineseWallTypes>
					<Type>cw_SystemManagement</Type>
				</ChineseWallTypes>
			</VirtualMachineLabel>
		</SubjectLabels>
	</SecurityLabelTemplate>

</SecurityPolicyDefinition>

