<?xml version="1.0"?>
<!-- Author: Reiner Sailer, Ray Valdez {sailer,rvaldez}@us.ibm.com  -->
<!--              This file defines the security labels, which can  -->
<!--              be attached to Domains and resources. Based on    -->
<!--              these labels, the access control module decides   -->
<!--              about sharing between Domains and about access    -->
<!--              of Domains to real resources.                     -->

<SecurityLabelTemplate
 xmlns="http://www.ibm.com"
 xmlns:xsi="http://www.w3.org/2001/XMLSchema-instance"
 xsi:schemaLocation="http://www.ibm.com security_policy.xsd">
   <LabelHeader>
      <Name>chwall-security_label_template</Name>
      <Date>2005-08-10</Date>
      <PolicyName>
         <Url>chwall-security_policy.xml</Url>
         <Reference>abcdef123456abcdef</Reference>
      </PolicyName>
   </LabelHeader>

   <SubjectLabels bootstrap="dom_SystemManagement">
      <!-- single ste typed domains            -->
      <!-- ACM enforces that only domains with -->
      <!-- the same type can share information -->
      <!--                                     -->
      <!-- Bootstrap label is assigned to Dom0 -->
      <VirtualMachineLabel>
      	<Name>dom_HomeBanking</Name>
         <ChineseWallTypes>
            <Type>cw_Sensitive</Type>
         </ChineseWallTypes>
      </VirtualMachineLabel>

      <VirtualMachineLabel>
      	<Name>dom_Fun</Name>
         <ChineseWallTypes>
            <Type>cw_Distrusted</Type>
         </ChineseWallTypes>
      </VirtualMachineLabel>

      <VirtualMachineLabel>
        <!-- donating some cycles to seti@home -->
      	<Name>dom_BoincClient</Name>
         <ChineseWallTypes>
            <Type>cw_Isolated</Type>
         </ChineseWallTypes>
      </VirtualMachineLabel>

      <!-- Domains with multiple ste types services; such domains   -->
      <!-- must keep the types inside their domain safely confined. -->
      <VirtualMachineLabel>
      	<Name>dom_SystemManagement</Name>
         <ChineseWallTypes>
            <Type>cw_SystemManagement</Type>
         </ChineseWallTypes>
      </VirtualMachineLabel>

      <VirtualMachineLabel>
        <!-- serves persistent storage to other domains -->
      	<Name>dom_StorageDomain</Name>
         <ChineseWallTypes>
            <Type>cw_SystemManagement</Type>
         </ChineseWallTypes>
      </VirtualMachineLabel>

      <VirtualMachineLabel>
        <!-- serves network access to other domains -->
      	<Name>dom_NetworkDomain</Name>
         <ChineseWallTypes>
            <Type>cw_SystemManagement</Type>
         </ChineseWallTypes>
      </VirtualMachineLabel>
   </SubjectLabels>
</SecurityLabelTemplate>

