<?xml version="1.0" encoding="UTF-8"?>
<!-- Author: Reiner Sailer, Ray Valdez {sailer,rvaldez}@us.ibm.com  -->
<!--             This file defines the security policies, which     -->
<!--             can be enforced by the Xen Access Control Module.  -->
<!--             Currently: Chinese Wall and Simple Type Enforcement-->
<SecurityPolicyDefinition xmlns="http://www.ibm.com"
 xmlns:xsi="http://www.w3.org/2001/XMLSchema-instance"
 xsi:schemaLocation="http://www.ibm.com security_policy.xsd">
<PolicyHeader>
		<Name>chwall-security_policy</Name>
		<Date>2005-08-10</Date>
</PolicyHeader>
<!--                                             -->
<!-- example of a chinese wall type definition   -->
<!-- along with its conflict sets                -->
<!-- (typse in a confict set are exclusive, i.e. -->
<!--  once a Domain with one type of a set is    -->
<!--  running, no other Domain with another type -->
<!--  of the same conflict set can start.)       -->
	<ChineseWall priority="PrimaryPolicyComponent">
        <ChineseWallTypes>
            <Type>cw_SystemManagement</Type>
            <Type>cw_Sensitive</Type>
            <Type>cw_Isolated</Type>
            <Type>cw_Distrusted</Type>
        </ChineseWallTypes>

        <ConflictSets>
        <Conflict name="Protection1">
            <Type>cw_Sensitive</Type>
            <Type>cw_Distrusted</Type>
        </Conflict>
        </ConflictSets>
	</ChineseWall>
</SecurityPolicyDefinition>

