<?xml version="1.0" encoding="UTF-8"?>
<!-- Author: Reiner Sailer, Ray Valdez {sailer,rvaldez}@us.ibm.com  -->
<!--             This file defines the security policies, which     -->
<!--             can be enforced by the Xen Access Control Module.  -->
<!--             Currently: Chinese Wall and Simple Type Enforcement-->
<SecurityPolicyDefinition xmlns="http://www.ibm.com"
 xmlns:xsi="http://www.w3.org/2001/XMLSchema-instance"
 xsi:schemaLocation="http://www.ibm.com security_policy.xsd">
<PolicyHeader>
		<Name>ste-security_policy</Name>
		<Date>2005-08-10</Date>
</PolicyHeader>
<!--                                                        -->
<!-- example of a simple type enforcement policy definition -->
<!--                                                        -->
	<SimpleTypeEnforcement>
        <SimpleTypeEnforcementTypes>
            <Type>ste_SystemManagement</Type>   <!-- machine/security management -->
            <Type>ste_PersonalFinances</Type>   <!-- personal finances -->
            <Type>ste_InternetInsecure</Type>   <!-- games, active X, etc. -->
            <Type>ste_DonatedCycles</Type>      <!-- donation to BOINC/seti@home -->
            <Type>ste_PersistentStorageA</Type> <!-- domain managing the harddrive A-->
            <Type>ste_NetworkAdapter0</Type>    <!-- type of the domain managing ethernet adapter 0-->
        </SimpleTypeEnforcementTypes>
	</SimpleTypeEnforcement>
</SecurityPolicyDefinition>

